sentimen,Tweet
0,moga2 by that time kita jumpa aku tak jemu lagi ngan budak ni 
0,takkan tak test2 lagi kutt aku kasi pukul 10 lebih tadi 
0,ya aku kan pasrah wkwk
0,income protection ni apa plan pengganti gaji untuk jaga kita dan keluarga kita sekurang nya 10 tahun dah ada ke 
0,bila tengok bencana di negara negara luar kembali sedar yang kita ni sangat bertuah lahir di malaysia 
0,kamu doang yang beranggapan gini
0,penderitaan terdasyat adalah kehilangan dan patah hati
0,beliaw sadar betul apa dampaknya bagi petani klo impor beras kok msh impor hey2 curhat ke relawan 
0,kamu sedang tidur di kamar kemudian ibumu datang mengetuk pintu membawa roti selai dalam toples amp segelas susu 
0,kamu yang ini bukan si aku lupa 
0,hi kakak salam kenal aku baru di dunia alter mohon sangat bantu retweet takan mengecewakan pelanggan dan takan membuat kec 
0,yak sesi presentasi dan konsolidasi penilaian pun telah selesaiekarang saatnya peserta dipersilahkan masuk ke ve 
0,kamu punya lesung pipi a ya b gak c satu aja captainkepo
0,pemberontakan PKI di Madiun tahun 1948 bukanlah membela diri seperti yang digaung gaungkan Aidit Jika hanya membe 
0,6 dokumen yang korang wajib simpan semasa travel ke luar negaraeeloknya simpan satu hard copy dan satu soft copy d 
0,siapa dapat first impression mcm niumpah aku ingat kau dulu sombong gila orang pun cakap kau macam sombong aku pun taku 
0,kaya kita mahal ih
0,Lalu baiknya kita harus jadi opo toh mbah 
0,repost satbrimobpoldasulsel panggul jenazah anggotanya ketiga pamen ini tidak sungkan mereka adalah danyon 
0,mari kita berteman rt aja ya
0,revenue naik tp expenses naik apa yg kau nk ckp ni
0,klopolitik mau memecah bela yakin ada batik yang membuat kita setara dan merasa terhormat haribatiknasional 
0,coba deh kamu liat diri kamu sendiri
0,iya kan kamu balesnya baru sekarang 
0,nggak gue juga berharap ko ' 
0,giveaway gatau dlm rangka apaan buat 2 orang pemenangatu orang pulsa 25k all op satu orang dapet semua produk diba 
0,yuk melihat arah tujuan hidup kamu berdasarkan 12 zodiak ini 
0,aku nyautin doang 
0,5 ciri nyeleneh orang ber iq tinggi kamualahatunya gayajitu
0,hari minggu dewan penasehat rapat perdana di mbs 
0,kalo aku ga kenal berarti aku belum tua ya kan
0,tugas kuliah yg belum selese bang dan harus dikumpulin besok pagi
0,oh god i remembered i pernah minum teh kurus memang selalu la ke tandas but i felt like selera makan macam bela s 
0,dlu time skolah tak sampai hati xmakan ape mak masak utk sapan kalau dah lambat pun aku tetap akan makan atau 
0,sudah sudah wudhu gila kamu 
0,its rm25 per case kau nak ke aku tak suka casing cartoon ni kalau lockscreen or wallpaper okay lagi
0,cuba tegok apa yang melintas depan dia 
0,adoi dekah aku 
0,iyaaa kalau aku naik kelas 
0,jebul aku meneng kono yo meneng 
0,kisah dia sama seperti aq kot 
0,ya iyaaa laaaahejakd juga udah pada taauuuu 
0,pm kata ok kamu semua nak sibuk apa 
0,kamu buci
0,giveaway diadakan dlm rangka bday guanlin mau tambah tmn monbebe amp nctzen 
0,jaga umi kt hospital pastu jaga atok pulakemoga allah berkati segala urusan aku 
0,aku rasa tak sabar nak balik utp untuk training netball je ni belajar and etp tak ready lagi 
0,lek sis aku pun 
0,bekas lindesan banini merapat ayok kita mutualan rep aja dnku ada tulisan ga di 
0,kemarin aku liat ada yg romaji ke hangeul bisa baca hangeul ga kalo ga bisa ya ntar boleh deh aku ban 
0,knp indo beda sendiri min knp gk barengan dengan mereka apa ruginya dan apa untungnya 
0,dan setelah salam mendadak berubah lagi menjadi puanass poll seperti semula kupikir ya mungkin aku sedang diuji 
0,siapa ada thread movie korea yang best best or tahu movie korea yang boleh membuatkan orang keluar air mata ke apa ke do tell 
0,3 dengan mengabaikan uu dan tinjauan sosial politik alasan yg paling mendekati kebenaran adalah tidak ada alokasi anggar 
0,tulus jangan cintai aku apa ada nya 
0,rujak kangkung itu satu iket kangkung btw itu foto sblum makan kenyataanya aku rebus 1 iket lagi tempe abis 4 d 
0,jika kamu terlalu berkeras dalam dakwah hingga sasaran dakwah kamu menjauhi dirimu maka untuk siapa sebenarnya dakwahmual 
0,aku kat warung pak sudin niambil hirup teh tarik panas sambil jalan buah dam 
0,terus suka ada yg nanya kok aku pake kode cashback cuman dapet 30k kamu pake kode org lain yg dapetnya 30k say nih ca 
0,someone tolong kutip dia aku tak larat dah nak simpan member bodo cmni 
0,open follbackyarat follow westhingy rt tweet ini reply done aku tunggu sampai jam 00 00
0,biarkan mereka mencari jodoh sendiri '
0,semua dah kenyang kalau tunggu pun tak dpt apa
0,gue sampe gatau minta di kado apa ntar buat ulang tahun 
0,aku paham nya kalau mereka lagi dideketin sama cowok gitu masa 
0,gempa di indonesia 50 tahun terakhir hidup di zona cincin api dibarter kesuburan tanah tapi hidup bukan mengundi d 
0,dear apakah garansi asus rog mencakup adaptor chargernya juga 
0,apa nya yng bsah mbaj
0,kangen seseorang kangen lah tp bisa apa el de errrrr 
0,tgl 26 27 dinnn kamu kesana juga a 
0,dua nikmat yang sering luput disyukuri waktu luang dan kesehatan
0,mahal kita pero di mo lang ramdam 
0,5 ciri nyeleneh orang ber iq tinggi kamualahatunya gayajitu
0,cerita aku lebih kurang mcm ni tp lain sikit ex aku yg kenalkan aku dekat family dia siap kenalkan dkt makcik p 
0,beragam cara dilakukan untuk memberikan bantuan bagi korban gempa dan tsunami diulawesi tengahalah satunya sep 
0,aku mau hetalia 
0,2 jika ingin anak anakmu berhenti bermain jangan berkata dah sudah main stop sekarang tapi katakan kepada mere 
0,kenapa ya akhir2 ini aku suka makan ciz 'n chic 333
0,ya allah kisah yg kita dengar hanya ada dalam kitab suci kita lihat kembali 
0,aku anggap orang yang ws aku asyik typo ni dia memang tak beria pun ws dengan aku 
0,cinta aku ke kamu itu ibarat bulu idung idung ga akan bisa tanpa bulunya begitu jg aku tanpa kamu 
0,iloveaceh kustomfest mengambil tema 'color of difference' gelaran ini digadang tak hanya menjadi ajang pameran mo 
0,aku takde rezeki mcm orang lain boleh duduk dengan ayah memasing sekarang ni
0,penganiayaan thdp bu ratnaarumpaet ini mengingat kan kita pada film2 barat ttg bgmn musuh hendak mengancam korban 
0,kpopers indonesia peduli mengajak semua kpopers indonesia utk bergandeng tangan amp bersama sama membantu meringankan pende 
0,aku pake innisfree 
0,iyalah kalau sampe tertukar nanti kita bikin ftv aja unn maunya gitu tapi apa daya aku mirip kentank 
0,malam ini adao7 15 16 besok ada semi final amp final japan open terus aku buka laptopnya kapan 
0,satu aja 
0,jika lawankemustahilan pernah membawa kita juara kenapa tidak kita dengungkan lagi sekarang yuk ah 
0,sekretaris bpk roma doriss mps m eng menjadi narasumber bimbingan teknis pengelolaan pelayanan i 
0,apakah sudah templatenya kalo udah jadi mamah mamah tuh kalo ada bagi2 hadiah atau apapun akan bilang aku satu lagi dong b 
0,endampai aku dpt uang buat subsidi ongkirnya ayo janganampai flop yaa good luck 
0,sungai amazon sendiri bertanggung jawab atas pemberian 20 air tawar dunia keamudera atlantik yang menyebabkan 
0,pak mohon ulurkan bantuannya pak sahabat kita pendukung prabowosandi dia n penduduk l 
0,selamat hari batik nasional kawanpajak haribatiknasional ayo lestarikan batik sebagai warisan budaya asli indones 
0,kalau zaman dulu batik hanya bisa dipakai oleh anggota kerajaan kalau raja di hati kamu siapa haribatiknasional
0,eh tiberrrrr 
0,newbie temen aku gisel 18th info tarif bo wa 087889579842 serius chat ya include hotel tebet availjaksel openboj 
0,jangan khawatir kamu tinggal beli concealer atau foundation masalah terselesaikan 
0,kepada para sahabat viking dan jak mania kejadian pengeroyokan tak ada kaitan dengan fanatisme klub tak ada sweeping kejadian 
0,ada sikit kongsi cara sikit takdak apa jangan dok pandai kongsi apa rosak masyarakat harini bila dia taktaw apa2 tent 
0,lupakan sekejap je nanti lepas pt3 aku ingat balik okey
0,181002 g c f in newark jin menyikat gigi rm kamu menyikat gigi dengan menggerakan wajahmu noted cara baru 
0,silakan di save bagus nih untuk persiapan bagi yang tinggal di daerah rawan bencana
0,selain babi dan anjing untuk gelaran kepada sesuatu yang kita tidak gemari beruk mat yey monkey juga turut boleh disenara 
0,selain presentation kita boleh lakukan sesi perdebatan 
0,mak mertua pernah kena copek dek makcik tua dalam kedai tudung dekat jalan tar lepas tengok cctv yang jelas macam hd 
0,ada pakwa pun macam ni jugak 
0,kamu bekerja apa hft
0,Kamu mau mainnya kemana 
0,korang tahu tak ada apps namaocar untuk sewa keretaekarang tengah ada banyak promotion sbb baru lagi aku baru tempah k 
0,kita tak ws dia sebab dia kata busy assignment online katanya tengok note kt ws rupanyan time aku tak ws tu dia menggatal de 
0,iphone 7 paling cikai sekarang ni aku rilek je dah 2018 still pakai iphone 5s camera jahanam screen retak housing berlo 
0,gapapa sih kan aku tinggal copast 
0,baru tau mereka indonesia sudah khatam soal ginian
0,syedadiq tu nak pulihkan kerajaan era baru tapi yang perempuan dok gedik gedik kata cair iman lah apa lah alahai aku 
0,kepada pak dan sertaeluruh anggota polri di manapun berada jargon polisi itu profesional da 
0,boros dong aku 3g 4 hari palingan
0,membe aku baru lepas guna pickup line masa nak bayar makan tadi awak orang mana malaysia yela duduk manaini je 
0,dieminar relationship blueprint kamu dan pasangan akan belajar kerja sama membangun kesepakatan dan kompromi hub 
0,dokumen yang keunggah biasanya bukan syarat utama untuk jabatan yang kita 
0,tengah2 malam lapar ulang alik gi peti sejuk 4 5kali buka jenguk tutup buka jenguk tutup terfikir gak kalau peti 
0,saran untuk 2018 dan pap terbaik mu udah deket 2019 aja nih sorry baru answerrr jangan kecewa kalo cita2 or hara 
0,bila kita layan elok orang layan nak taknak 
0,petang habis kelas kita serbu arked lestari boleh padankan dengan nasi ayam penyete 
0,siapa yang tahu pak ahok nyindir siapa yahc aku dukung dendamnya pak ahok untuk mengusut pejabat brengsek pantesan bis 
0,jurusan bhs jepang nder mutualan sama aku sini 
0,untuk material bantuan selanjutnya sebaiknya jg diperbanyak pakaian laki2 untuk saudara qt korban gempa tsunami palu dongg 
0,kl dorm jakarta aku ambil deh
0,cantik alami tanpa skincare make up yang berlebih dan operasi huhuhu btw dia bukan orang indonesia ya teman 
0,ni nak femes je sebenarnya 
0,ini wawancara pertama saya dengan ketum pssi edy rahmayadi pertama kali dan tidak pernah lagi 
0,aduhh ni tmpt yg aku nak p sgt ni dah 2 tahun mengidam nak pergi 
0,setiap ada bencana selalu diwaspadai pihak2 yg mau nampang di publikaat tsunami aceh ada salah satu organisasi besar yg han 
0,assalamualaikumaya dngan rndah diri mmohon bntuan pengguna twitter agar dapat mmbantu org tua saya baru je mula bernia 
0,making love masih sendiri yuk cari pasanganmu pakai aplikasi blued pastikan kamu udah punya blued versi baru link 
0,hati hati dengan kata kata mereka bisa membuat otakmu tumpul atau tajam tergantung apa yang kamu serap asah kesadaran t 
0,tema colour of difference atau warna perbedaan ini kita ambil sebagai upaya kita dalam menyingkapi apa yang terjadi 
0,mereka berkata hai dzulkarnain sesungguhnya ya'juj dan ma'juj itu orang orang yang membuat kerusakan di muka bumi maka da 
0,seandainya smua temen2 di fbku tau apa yg aku dapatkan dari join bisnis nuamoorea ini pasti semua antri daftar member 
0,aku pun nak jumpa hmm 
0,aku si balik ke dokter yang masang
0,siapa mereka coba kontak 
0,buah oren ni lagi ploles dari kulit muka aku sial 
0,askmf kata cowoku aku lebih ganteng kalau pakai bikini 
0,tutup la aurat kalau ye pun hehehehe 
0,dan setelah aku tanya kesalah satu ibu2 itu ada yg jwb aku liat di fb bisa buat lumpuh tangan bengkak dan buat i 
0,tls followan ama aku yukk rep rt kita temenan
0,bile kau tanya member kau makan ape sampai jadi kelakar macam nie kau tengok lah perangai dia bunuh jela aku kalau 
0,dulu aku pernah berpikir bahwa segala hal dapat diperdebatkanekarang aku lebih sering berpikir ini gak perlu diperde 
0,help butuh donasi buat kucing jadi ini kucing suka ada disekitaran rumah aku dulu sering bgt kerumah dan tidur di ku 
0,nanti aku ws kau k
0,jangan lupa follow sosial media entrasol mention 5 orang teman kamu dan gunakan hashtag byebyefaktoru nutrisipalingnger 
0,aku pernah cuba berbaik dengan kawan akuhe s the first person yang tegur aku masa memula masuk kole 
0,batik merupakan salah satu warisan dunia yang menjadi identitas bangsa indonesia nah sebagai generasi muda apa si 
0,mau ganti header ah
0,jika anak tempatan pd hebat bagi pengundi warga pd keutamaan tetap orang tempatan pd tidak kita siapa 
0,askmf keadaan iphone 4s aku sekarang 
0,Kata Yuval kenapa kita bisa kejam dan barbar 
0,bila member yang selalu buat lawak hambar and for the first time dia buat aku gelak and i be like 
0,aku akan cuba sabar dengan kau tapi bila aku dah penat sorry lah 
0,waktunya makan siangg jangan sampai dietmu membuat kamu kelaparan alhasil metabolismu tubuh melambat bukan m 
0,everything needs a closure bukan setakat lost contact or awkward dan alasan seangkatanya srsly dalam dunia ini pun kita ad cl 
0,nctzh DY as your brother Kamu masuk tanpa mengetuk pintu You kak pinjem cas hand Kmu kaget melihat teman DY 
0,pastu tekan la kat tangan tu biar keluor minyak dah full tu retak2 sikit letok smula kat tempat dia p 
0,isteri tak sihat sejak smlm mcm biasa aku keluar pagi jam 6 30am dia yg akan hantar anak2 ke tadika taska but to 
0,broimak video ini ribka tjiptaning penulis buku aku bangga jadi anak pki dia setuju pki harus tetap ada yang pasti d 
0,temu usaha mice upaya tingkatkan kapasitas dan produktifitas umkm 
0,ayo kamu bermimpi dulu 
0,kemungkinan besar aku bawak buku ke sini tapi waswas lagi lah kobekfest 
0,act membuka kesempatan bagiahabat untuk menyalurkan bantuan bagi saudara kita yang terdampak gempa di palu dan dongga 
0,dan sekarang lagi sering bales balesan surat sama beberapa orang dari malaysia turki dan taiwan terus tadi barus 
0,ini masukan yang baikemoga pak dan jajarannya sdh sigap dan tanggap melakukannya kita butuh semua elemen bangsa u 
0,ntar aku bilang kak changbin dulu ya kamu mau changbin hyunjin gak 
0,bgun pgi je bkak twitter tgok2 dh 10k tq smua nie lgi sorang aku bgun2 je dia dh ad kt seblh penat sgt lh tu sian dia candi 
0,katanya artism ga ke mnet lagi setelah aku liat ternyata m super concert tgl 9 kemaren itu mnet dan ada nct bahkan exo hmmm kubingung
0,rlt lahkrg udh ada ginian ya allah ini ygelalu akuebut dalam doa dari dulu ketika 2 temanku asik nonton oppa tapi a 
0,twitter please do your thing teman teman tolong bantu sebarkan sampai saat ini sahabat saya natachia massie dan keluargan 
0,video dari kokpit pesawat c 130 hercules a 1320 saat pertama kali mendarat di bandara mutiarais al jufrieabtu 29 9 2018 pa 
0,lah aku gatau itu email sm passwordnya apa itu kan jadoel
0,grup yg sekarang kamu bilang overrated itu dulu pernah jadi grup yang underrated 
0,nak minum fikir owner ahuruh isi air memang tak ah bontot nak angkat bawak botolnya ni la yg payahnyaekarang ni aku h 
0,nder kamu beli apa aja aku bingung mau beli apa wkwk
0,kalau renungkan semula akan perilaku kita kitalah orang yang paling tak layak untuk mendapat syurga allah abangenior 
0,Awak Ada personal gn saya ke Kalau Ada slide to dm Kita bincang
0,kami pon berlari pergi dekat bas dn aku pegang tiket okaylah nak tunjuk dekat akak tu lepastu yang rase mcm as fck 
0,terasa sampai kedalam kontol kamu sbesar ini gak masukin ke meki tante dong 
0,aku kat luar ni dah 10 minit 
0,LAJSDJSJ WOI GEMES BGT DONG MEREKA 
0,sering banget aku overthinking sama semua hal terus di sampingku agus lg nonton yutub entah stand up comedy ketoprak war 
0,makin besar ko masih buat centu aku pancung ko dik
0,likuifaksi hanya terjadi saat gempa pada lapisan tanah pasir halus dan kondisi jenuh air lagi beol di tv ada yang ngomongin 
0,5 ciri nyeleneh orang ber iq tinggi kamualahatunya tips trik
0,rpw heh perkedel tumbuk kamu jahad 
0,this haha
0,spesial untuk kamu soners di indonesiana ada takpunyahati jam 2 siangtay tuned 
0,kg di masukin kontol aku cuma mau jilatin memek kamu say
0,adakalanya kita dihadapkan dengan ketidakmampuan dan membuat diri kita mundur dari tantangan batasan tersebut ada untuk menguji d 
0,kalau ada jangan lupa tag aku 
0,buat yg masih jomblo kalau ada teman saudara yg menanyakan kapan kapan menikah ada jawaban yang bisa digunakan 
0,baca lagi mau resign kerja pastikan kamu lakukan dengan terhormat 
0,es ada yg mau jd abang aku 
0,aku mimpi amir cena ni 
0,jika kamu seorang detektif setidaknya kamu bisa menganalisa apa yang kurasakan mouri ran 
0,hadeh yaudah aku juga mau ancang ancang dulu deh
0,jika ada bencana dahsyat kita cenderung mempertanyakan keadilan tuhanah tapi kita juga perlu sadar bhw manusia adlh 
0,mana sih kemaren yg mau top up'in saldo gopay aku udh di kasih nomer nya juga padahal 
0,nasi lemakemangkuk dia rare sebab letak telur goyang sekali bukan satu tapi 3 bijiambal dia aku suka pedas2 manis 
0,sudah terfollowback eonnyie 
0,hai nip apa nama panjang kamu nipea body lotion aku debby 99l 
0,ceramah ustad m arifin ilham thn 2014 video 1 silahkan simak dan tidaklah mereka orang orang munafik memperhatikan bahw 
0,hai mengenai hal tersebut mohon lampirkan bukti screenshot kendala kamu agar kami dapat bantu cek lebih lanjut ya 
0,hahahaha iya aku bagian parut parutin kelapa sama meres santen
0,wktu jepang luluh lantah krn gempa amp sunami ada temanku cerita mereka diperbolehkan ambil makanan minuman secara gra 
0,loh tiny kamu kok keliatan tinggi 
0,coba pake deo yg nuskin nder menurut aku bagus sihh karna dlu pas smp juga aku agak bb gitu setelah pake itu syudah tidaaaaa
0,ada yang bertahan karena sayang ada juga karena terpaksa menurut kamu kapel kamu yang mana 
0,aku nasihatkan kalau resign please la tukar numberakit hati wey ari2 call tanya pasal kerja 
0,nominee pertama tentu saja tanpa perlu banyak alasan atau bahkan 5w1h atepatukantekadjuang dengan retweet likes jika k 
0,mungkin jiwa aku dgn jiwa hang lelain hm
0,mas joko kapan mobil andalan ini di wisuda dan dapat ijazah perasaan dari taon jebot ini mobil ujian mulu 2019ga 
0,walaupun serak dan sesak tapi lagu ini salah satu lagu buat yang merasa tertekan walaupun gaada orang lain yang tau tapi 
0,kalo ada yang mau angkut dm aku yaaa bantuin temen ku soalnya dia butuh uang 
0,apa ini kkkk gt lt 
0,haha biasa je just sedih la asyik berjemur kat panas hmm aku tak sabar nak habis je weh
0,aku berhasil meraih 1298 poin hari ini yuk ikuti kuis trivia akudankorea yang diadakan 4 posisi ter 
0,kita kemarin di posko pengungsian yang ga gede gede amat aja ada dramanya 
0,tiap inget ultah jinu inget kue ultah choco pie dia dengan simple wish bisa rayain birthday lagi di saat debut dan semua 
0,aku gak bisa berenang dan gak tau siapa margaret thatcher hem
0,conclusion walaupun matawang kita di tahap lemah harga minyak naik 10usd bbl sejak februari lalu harga minyak ron95 da 
0,registerkan utk aku dulu ni serius ni
0,motor dua pintu apa karna pengaruh bucheen kamu jdiemakin bodoh ka 
0,penasaran aku biasanya apa yg bikin kalian mau nonton sebuah film lebih dari sekali di bioskop krn ceritanya ngefans akt 
0,aku jual 
0,mamanya minta tea pai di medan aku si ikut aja kamu ke medan juga dong 
0,krt mereka adalah dia biasku yebin kalau kamu 
0,iyaaa verified kakkk aku kira td boongan acc fans bodoh emang pdhl udh ada verified 
0,krn kmrn akueneng bgt 1eventeen ngeluarin goingeventeen tadi malem 2 dan yg di tunggu akhirnya exo keluarin t 
0,bila masa charlie gigit aku ni 
0,oh iya udahlah gausah bilang your handsome sama kamu 
0,rdp komite i dpd ri dengan dirjen otonomi daerah kementerian koord bidang politik hukum dan keamanan ri dan dep 
0,maka dari tersebut kenapa kita mesti lakukan sarapan sekalian menentukan type sarapan yang pas 
0,aku itu gendut bukan karna makannya banyak tapi karna dari kecil diajarin makan harus sampai habis kalau gak nasinya nangi 
0,aku lahir dari mama papa beda negara ya gitu aku bule blasteran indo dan amerika mama lahir di amerika papa di i 
0,aku sampai masa hang balik 
0,presiden mengemukakan dua hari lalu dirinya telepon dari raja arabaudialman bin abdulaziz alaud terkait benc 
0,perlu juga kita sadari bahwa batik telah terkenal ke dunia fashion internasional karena itulah kita perlu menjaga 
0,selamat hari batik nasional 2018 bisakah kamu menemukan ada berapa kartu kredit bca edisi batik di gambar ini https 
0,gua harus pilih formasi apa dan di mana galau akutuh besok udah pendaftaran 
0,wannaone giveaway hai wannables masih ingat triple position ada satu set pin enamel dan totebag triple position untuk 2
0,biar english aku teruk ke apa aku nak koyak jap
0,read all the rplies perempuan perempuan sedang mengacah realitinya nak yg kaya hensem dan spend banyak masa untuk diorang 
0,belum masuk musim hujan mungkin alam masih memberi kesempatan kepada kita untuk berbenah saluran air atap rumah 
0,giveaway pulsa 20k untuk 1 orang pemenang caranya retweet dan follow akun aku aja ya pemenang aku umumin tangga 
0,smtown generasi pertama amp awal generasi kedua 
0,terus benamkan ratinga di google maps kunjungi dan beri 1 bintang boikot hotel yang mem 
0,siang cinta dfas ditemani diandra di d'req np sadarkah kamu 
0,waaah udah ngoleksi badge aku baru suka sejak 2016 dan baru beli merch tahun ini itupun cuma merch y 
0,mac ni bukan betul sangat kalau convert jadi lain karang habis kerja aku 
0,bisa gak ya aku menerjang 1 semaster ini yg jadwalnya super absurd dan banyak tugas 
0,aku dah send resume tau
0,someone tolong kutip dia aku tak larat dah nak simpan member bodo cmni 
0,didesak tetapkan gempa dan tsunami paluebagai bencana nasional ini kata jokowi 
0,tls followan ama aku yukk rep rt kita temenan
0,say rumah aku sepi abgngentot teensex teen nude naked ngentotabg bokepindo ngentotwanitaberjilbab http 
0,kenapa aku typo 
0,bagi aku je lah kacang tuuu 
0,bahasa orang sulawesi suku bugis tp aku tinggal dikalimantan dan kotaku ini kota peralihan gtu jdi smu 
0,lepas tengok movie onetwojaga teringat pulak time intern dulu kerja dengan contractor sebagai quantityurvey juruuk 
0,hm kenapa lah tak letak fw pagi pagi ahhhhh kalau tak sekarang ni aku dah free 
0,dan masih main ganda pula 
0,lebih baik kita menunggu saja berita yg sebenarnya karena media pun masih 
0,yang harus diurus badan soalnya bisa tetiba melar ga kerasa ntar nyesel loh npwp aku ga paham 
0,tf tbtb aku ahli nutrisi 
0,aku diabetes
0,karena warisan dari orang tua kenapa ga pindah meski itu cuma warisan meskipun aku belum terlalu alim masih 
0,ep 815 the bigecret revealed the dan bonginohow 9 26 2018 via 
0,bila kau dah penat untuk jaga hati orang yang tak pandai nak hargai ni at the end dalam fikiran kau apa nak jadi jadil 
0,gue bukan army atau pun fandom kpop lain tapi sekarang dengan lu ngomong kaya gitu nunjukin betapa suksesnya m 
0,selamat hari kopi internasional entah diminum berdua di atas meja kafe maupun di pinggir jalan selama minu 
0,sape la buat kawan aku gitu haih
0,top 5 super40era haaaa tepokkkk 1ampai bila 2 tak pernah hilang amp 
0,mau aja ntar kita sekalian buka jasa angkut antar kotaumpah gapapa 
0,jadi daster ya kl dipake kamu
0,baca replies je terus jumpa tuan punya badan urm 
0,setia itu ujiannya seumur hidup lulus sekali nanti ada ujian lainnya pemicunya bisa banyak hal yang awalnya kita pikir 
0,halo untuk siapapun yang merasakan hal yang sama kita semua menyembunyikan masalah yang orang lain tidak perlu tau mari s 
0,2 tipe orang saat makan nasi kamu suka nasi apa 
0,submit in pdf instead of pptx okay je kan bukan apa aku risau convert to pptx nanti miss takboleh nak read
0,nanti kita repeat lagi ye
0,antara sebab aku masih cintakan uia ada saja insan insan yang memikirkan perut orang lain ada saja cara mereka unt 
0,abang aku dah bengang 
0,semoga keluarga saudara dan sahabat kami yang terkena musibah kemarin diberikan kekuatan dan ketabahan lindungi 
0,17 kalau mau nuruti logika pendukung yg dangkal itu justru mereka yg harusnya insyaf data dan faktanya gubern 
0,dulu kita rapat sangat terlampau rapat tapi sekarang dah macam tak kenal antara satu sama lain aku dah agak benda 
0,twitter kamu sepiini upfoll rp aktif di aku tag lelang acc
0,tayang mulai besok di cgv tiket venom sudah bisa kamu beli dari sekarang melalui atau datang langsung 
0,terus kalo kamu gimana mas 
0,bro boleh differ tak specs iphone x and iphone xr which one patut aku pick currently using iphone 7
0,tapi feeling aku sih johnny
0,inilah 10 dokter tergila dalamejarah kedokteran eksperimen yang mereka lakukan 
0,mereka tau medan disana seperti apa gak yaaa kira2 kalau jalan seperti ini apa bmm 
0,suara nya emg beda beda ada ciri khas masing masing kalo sering dengerin lagu mereka lama lama hafal kok 
0,wtf lawak tahun 1957
0,memang best tengok ikan datang aku pon pernah buat dekat pulau bagi makan roti tapi perbuatan tu salah ikan kene ma 
0,apakah semua klub sekarang anti dengan persibampai salah satu tim yang akan ke bandung lebih memilih merelakan poin beg 
0,bts telah menjadi artis yg tampil distadion stadion besar dan menjual jutaan album skrg tp saya masih seorang pria 24 
0,aku nk panggang dia please
0,ustaz tu pun confuse 
0,hasil scan otak orang yg rajin exercise dan yg mager malas gerak dan lbh banyak duduk otak orang yg rajin olahrag 
0,siapa yang nyuruh kamu dlosoran di lantai nak 
0,Haloobat Nonton Mtix Pastikan kamu tahu info ini ya Cek kode booking Mtix mu melalui email atau pada purchase history Ap 
0,abis itu kita goreng
0,persija kamu jarangendiri curvaud on tour persijaselamanya 
