sentimen,Tweet
-1,Iyaaa mereka mah makin tua malah makin menjadi2 pusing aku sama mereka vid 
-1,cuaca macam ni buat aku malas nak klua beli makan
-1,dulu perempuan bepergian sendirian dianggap hal tabuekarang sudah banyak pelancong solo perempuan walau masih ada yang m 
-1,mau cantik atau ganteng gak bisa jadi jaminan bikin kehidupan kita jadi menyenangkan apalagi yang jelek twitcak
-1,kenapa kurus kering sangat ni tak cukup makan ke dia tak tahu yang aku struggle gila nak tambah berat badan t 
-1,kampret memang cebi mereka selalu berteriak pki 
-1,saya tdk mencibir bro akan kterlibatan pihak luar anda baca lagi deh kalau anda ngarep bantuan ln lalu anggap k 
-1,bedes2 psikopat akan dengan mudahnya melakukan tindak kekerasan khususnya ketika kekerasan itu dipakai untuk mencapai tujuan 
-1,enggan melepas hati yang satu tetapi menggoda hati yang lain kamu ini kemaruk jadi manusia 
-1,susah jugak muka ganas niampai mak sendiri kata muka penyamun mcm aku 
-1,maaf kamu terlalu baik buat aku mba 
-1,tapi gimana ya kalau aku sih mending ga usah memulai sesuatu yg ga bisa kamu lanjutin iya kalo misal 
-1,semua nak boyfriend aku nak straight as je weh me crushing on good grades is hurtful
-1,kecewa sih tapi yasudah namanya juga sepak bola indonesia kalo kamu bisa juara sungguh luar biasa dije 
-1,takkan aku nak curi feedback orang semata2 nak attract cust tu bukan cara aku bisnes ada jatuh bangun ni mental kena kuat
-1,tmj tak berani sebut nama chedet perangai baling batu sembunyi tangan dan pukul lari ni serupa perangai budak belum mata 
-1,kiri kamu mikir sudah memporak porandakan hatiku kanan you wrong hunny aku baik baik saja dan bahagia 
-1,nda seneng loooh malah sedih ndaiso dateng wkwk kamu ojo sek ya ntar ae pas aku wis dirumah wkwk
-1,aku tak faham betul jenis orang malaysia yang tak reti nak sangkut balik hose tu aku geli bodoh nak pegang 
-1,gimana mau tirus kamu ngasih cokelat mulu 
-1,orang kata jangan benci nanti lama lama jadi sayang patutlah jerawat aku tak hilang sebab aku benci gila dekat dia 
-1,skrng kasih tau sama kamu tuh org yg suka tereak kafir biar mereka paham
-1,jangan kau ungkit jangan tinggalkan aku jfclosedday
-1,1 thing tak suka duk sini kulit aku mesti jadi kering
-1,hm yang kita nak pegi milo kepal tu bodo anjing 
-1,dia suka bagi fake hope kat aku 
-1,aww aku terinfeksi ayo maju loe kita gelut
-1,hahahahaha aku pun tak faham weh
-1,lawanya dia tak macam aku hm kau nak tahu tak apa dia hidup ni kalau asyik dibanding bandingkan kau takk 
-1,aku pun turn off kalau lelaki pergi clubbing hshshshshshsh
-1,wahai lelaki jangan kau sesekali merosakkan perempuan yang betul betul sayangkan kau hormat mereka ingat kau ada mak k 
-1,tapi nak perbetulkan apa yang dah hancur tu mustahil bagi aku la aku tak dendam tapi aku tak boleh terima dan lupakan 
-1,mesakke ik pengen aku ngewangi mbeneke
-1,ini serius beneran mereka makin kurang ajar maen kekerasan
-1,jika kamu pikir flirting adalah hal biasa selama ini kamu salah flirting dapat menjadi sumber masalah jika pemaka 
-1,nda fitnah ya wleekkk emang kan bulu ketek kamu basah ewhh 
-1,duh upaya kita menjegal persib dengan mengurangi poin mereka gagal nih coba pemain pemain jagonya aja kita jegaltrik 
-1,kita memang tak boleh lari dari jenis kaki ampu kaki kutuk kaki berlagak kaki busuk amp kaki bangku itu normal 
-1,aku nak beli memang tak sesuai ah aku tak suka kucing 
-1,karena aku pernah kayak kamu udah gapapa klo ga tahan lebih baik mundur drpd mengaruh ke psikis
-1,gapantes dikasih kita kita mah apalagi elu
-1,masih ingat lagi tak macam mana mula mula kita kenal dulu awal nya aku tertawa dan akhirnya aku menangis 
-1,masa kecik kecik dulu aku tak ikut mak aku masuk dalam sebab fikir macam ni laaa 
-1,kok sedih aku masih gantungin dm kamu nih lagi mikir 
-1,Karna kamu yang jelek 
-1,harusnya dia ngatain si cowo aja katain gigolo kek germo kek apa kek yang jelas tanpa ba 
-1,terkadang bukan kenangan buruk yang membuatmu bersedih tapi kenangan indah yang kamu tahu hal itu tak akan terulang kem jokamlicious
-1,dyam kamu asam glukosat
-1,kenapa jangan pernah bangga karena pria ini lebih memilihmu bukan karena kamu lebih baik tapi karena sesaat kamu men 
-1,anak bulu yang masih rewel dan nangis dari kemarin karna penyesuaian tempat baru cuma mau diam dan anteng kalau ud 
-1,ya ampun ku harap bisa ganti dan aku mau gantiii
-1,aku berharap aku gak megang kelas bawah lagi 
-1,maka nya semua cuma lips service doang serimoni triak2 paling pancasilais triak2 paling nkri 
-1,kalau benar semoga pelaku segera ditangkap amp dihukum dan bu ratna semoga segera membaik kalau tidak benar semo 
-1,gara2 ngobrolin soal charm dan tampang jadi teringat mantan w yg aga kurang ajar pernah bilang tau gak sih orang 
-1,ini kenapa aku takut sama cowok udah berusaha untuk ga mau generalisasi but somehow it's pretty hard
-1,dan kalau kalah kamu bisa jadi laki laki ngaku kalah dan cari psikiater ndak 
-1,pengen mejuhin kamu
-1,complicated btul aku usha dak2 ptptn 
-1,k start from now aku kena kuat k jangan beria act like u dont care anymore  
-1,aku selalu berkorban dan rela mengorbankan perasaan demi kamu tapiemua ga ada artinya dimata kamu ' 
-1,brader ni hurai pasal gaji ltk dan apa yang dia pernah buat harap budak menteri hadam ishh tak layak betul jadi me 
-1,kesian aku tengok lge ni hehe bertabahlah nak compare buatlah prestasi dari 10 may 2018 sampai sekarang 1 january sa 
-1,sesungguhnya orang yang lebih kampungan adalah orang yang kalo apa apa share lewat base ga berani pake akun sendiri 
-1,jikaaku masih sayang tapi dianya tidak bagaimana aku tidak punya ice cream tapiakan aku cari agar kamu membaik 
-1,percuma mas lak aku seng wara 
-1,duh maaf aku baru on 
-1,kamu ga romantis soon 
-1,doa mereka sdh habis mas kan apbn p tahun ini tida 
-1,ada dunia di sekelilingmu ada aku di sampingmu namun kamu mendamba rasa sendiri itu 
-1,tlg please bg perempuan tu baca malu wei lagi malu bila dia beria cerita kat kwan dia n aku skli dengar aku n 
-1,mandiri online gak bida d buka apa lagi gangguan 
-1,huh bukan dua ke tu pasal aku benci mathematics 
-1,dan tidak ada negara yang berulang2 menyatakan akan diproduksi massal sementara kita ga data seberapa besa 
-1,eirockya yg di radal dan pim jg itu ga enak sih imo rasa soto aku ingin ke aeon 
-1,127 hours 2010 based on true story aron mendaki di sebuah canyon terpencil masa nak lompat ke seberang aron terjatuh 
-1,kalau tak bersungguh nak jaga aku boleh je berhenti berpura2 aku boleh jaga diri aku tanpa memaksa kau kau tak perl 
-1,kita heran ya ma punya apa di omongin orang ngga punya apa apa lebih di omongin orang dapet apa di omongin oran 
-1,dah kenapatudent poal ni aku login accendiri nak buat entranceurvey tapi keluar profile orang lain yang aku tak kenal
-1,lagu jangan bersedih brader tu sesuai utk aku sekarang gara gara math 
-1,ngomong apa sih kamu
-1,saat kamu jauh aku jatuh pelaminanhujan 
-1,mangai aku rasa mahal dia bayar ni
-1,dan kita masih saja tidak terima bila disebut dengan nama binatang 
-1,gue ga memungkiri di akar rumput ketidaktahuan dan kenaifan berpikir itu masih banyak yg gue sesali adalah elit terdi 
-1,dan aku pantang bila tengok mak pak yang jadi bodo n buat bodo bila anak misbehave kat public 
-1,tbh aku keluar rumah pukul 6 45 pagi then sampai rumah dlm 8 30 malam tiap hariebab jem and jauh 
-1,aksi terorisme tidak bersumber dari agamaemua agama amp semua ideologi di muka bumi pernah dijadikan alasan aksi t 
-1,sampai sekarang do aku tertanya tanya apa faedahnya kita belajar tiup recorder masa sekolah rendah dulu 
-1,mas sampean kan orang pinyer jangan terlalu nurutin nafsu ndak bagus sampean menyamakan orba dan pki itu kelewatan https 
-1,aku kangen kamu kangen banget 
-1,kita di gembosi secara terang2an dan aku yakin kita bisa melawan kemustahilan sampai mendapat bintang 3 di dada 
-1,d terlihat cantik dan flawless di cermin nyatanya kucel muka bantal 
-1,mikirin orang yang gak pernah mikirin kita itu emang bikin gila 
-1,bodola emma tak jadi aku nak murung harini 
-1,once last month i will never listen to tt ever again the minute it hits october 1st im nayeon yoo jeongyeon momo jjang 
-1,makin belajar makin rendah hatiebab kita nampak sejauh mana jahilnya kita allahhh rindu zaman belajar 
-1,enek bgt pait bgt aslian trus keselek dong pas minum kek gitu hadeh bikin trauma astaghfirullah 
-1,aku ngiwo koe nengen aku lungo ojo kangen 
-1,sampai sini sajalah persahabatan kita ada kesalahan kita boleh tegur dan maafkan ada pula yang melampaui nilai keman 
-1,maap ya kita emang bosenan 
-1,pernah hadapi murid mcm ni masa praktikal dkt tadika mmg fokus dkt dia la bg smangatentiasa btulkn apa salah 
-1,aku tak dapat hidup tanpa sahabat baik ku aku bahkan tak dapat membayangkan dunia tanpa sahabat baik ku erzacarlet
-1,dima gue gak berhasil masuk negeri akhirnya masuk swasta tapi emak gue gamau yang ecek ecek biarin mahal yang 
-1,bahagiaku kamu bahagiamu aku kenapa malah selalu ada celah untuk dia 
-1,ahhh kau sombong dgn aku
-1,perkara paling aku takut bila tak sengaja terlukakan hati seseorang 
-1,kalau kau abaikan aku tu kira ok lagi kalau kau tak put so much effort pun aku ok lagi but kalau kau layan orang lain 
-1,kangen dicariin yg sampe di telfon telfon terus ngomel marahin kita ngomelnya tapi tanda sayang bgt dan khawatir bgt 
-1,hai rizqi mohon maaf atas ketidaknyaman yg kamu alami untuk perubahan satu rute tidak dpt dilakukan mel 
-1,kita bertanya bang cepat tanggap kasus lain tp tuli dan lamban manakala peristiwa menyangkut lapindo 
-1,aku confuse dgn penjual kt malaysia ni macam asik tunjuk kekayaan je nak jual ke nak show off tunjuk kekayaan then 
-1,bodo betul aku terhibur bodo ada member ceni 
-1,kaos kakinya bolong tangannya kasar gak sekeren dan semilenial kita lah intinya tapi ketika ziarah di makam raja banjar yan 
-1,kayaknya kalo nonton langsung aku pengsan
-1,pak jokowi bilang ke bangandi betapa sulitnya mengelola negara sebesar indonesia ya kalau sulit ngapain juga ngotot 
-1,kenapa nak tolong ke awek tu tanya aku jarang tolak permintaan orang lagi2 awek kan ermm dia pun macam mengharap 
-1,idm army kita kalah masaaa 
-1,kalau hidup kita belum bener ndapapa karena akan selalu ada orang sok bener yang mbenerin hidup kita 
-1,lah situ ditegor polisi malah bilang abis ngiris singkonguami kamu pembunuh 
-1,math paper 1 boleh buat aku menangis
-1,tahu diri aja bisa gak sih da kamu tuh cuma prioritas ke 6 nya dia udah ya tahu diri gausah banyak minta 
-1,wkwkwkwk sombong abis kalau lo gak sekolah gak bisa sbm juga kaliekolah aja udah gitu gimana p 
-1,gak pantas org yg tlh menganiaya bu ratna dianggap sbg manusia entah makhluk apa 
-1,ada je lagi perempuan kat luar sana yang taknak apa apa pun daripada lelaki yang dia sayang bukan pasal duit materiali 
-1,aku yang bodoh ke lawak ni yang bodoh heheh
-1,argh semua sembang penat dah ajak semua busy koyak aku
-1,mungkin aku tersilap fikir selama ini 
-1,mampus aku 
-1,orang yang belum ada dalam hidup aku tolong jangan datang aku tak nak malas 
-1,wait kok jadi aku yang dipalakin jfclosedday
-1,kadang ketampanan dan kecantikan yang ada di sosial media belum tentu sama aslinya saat ketemu masa kamu mengabaik 
-1,kasihan banget umat jadi bodoh begini dan mental rusak karena ajaran agama yang tidak benareba 
-1,kampret gak bisa promosi prestasi om wowo karna emng tidak ada itu fakta jadi langkah yg merka ambil hnya b 
-1,jangan ambil dosen itu dia nilainya bagus cuma kita nanti nggak usaha apa apa aku merasa nggak worth aja sih g 
-1,cinta itu aneh dan menyakitkan hari ini ngomong aku sayang kamu besok nya udah ngomong aku mau putus dari kamu 
-1,aku dekat sini tengah hadap depression ada aku libatkan hampa ka sekarang ni takkantop kacau life aku la siaa
-1,berat nyerah saja
-1,7 tahun yailah masih bisa disepelekan orang indonesia korban mati pelaku harus mati 
-1,itulah ciri ciri orang sok pintar sok tau padahal nol besar memang demo itu apa artinya apakah kalau demo 
-1,lepastu aku pernah kena paksa dengan kawan kawan aku pegang kucing lepastu kucing tu bergerak gerak kat dalam dakapan ku itu 
-1,he stepped up when jay died and was there for lottie and all of her siblings it's sad how quickly daisy has forgotten that 
-1,penjarahan di palu dan warga yang tak ingin disebut menjarah 
-1,tolak partai penjual agama dan pendukung teroris 
-1,20thn aku pengen nikah umur 23 sm orang yang gini gini gini 23thn blm ada yg nglamar 24thn si 
-1,mau kemana kamu nan '
-1,kalau dia boleh buat aku bahagia buat apa aku tinggalkan kan
-1,duka palu dan donggala adalah duka kita semuaemoga semua cepat teratasi rahayu pak semoga allah selalu me 
-1,assalam macam mana lelaki boleh ingat jalan jauhelekoh belok2 tanpa rujuk maps even pernah pergiekali je kalau aku 
-1,kisah sedih minggu ini 
-1,hati ku satu tak patahkan jadi dua patahan yang satu kamu bawa agar saat kamu pergi dariku kamu tau ada orang yang menyia 
-1,kadang kadang apa yang kita suka tu tak semestinya kita miliki 
-1,cerita dia macam ni mamat ni hari2 aku nampak keluar masuk cimb ceria ja tapi hari ni aku tengok muka dia masam aku p 
-1,penat seyh
-1,kalau la boleh buat thru camera fuh mesti nonstop and kita rasa annoyingnya bebudak ipx ni hehe
-1,karena mereka kriminal untung masih saya baikin 
-1,singkatnya kebahagiaan seseorang berarti sebuah siksaan bagi orang lain ada orang orang yang ga peduli tentang tersiksanya 
-1,duh timeline twiterku terlalu receh aku tida sanggup 
-1,di masjid bahas bahaya narkoba setika itu aku langsung 
-1,pemikiran dangkal bener coba cari tau tentang lempeng indo dan indonesia sendiri kenapa kita bisa serin 
-1,pak dan bang memutuskan beberapa pekan ini tdk ke palu donggala untuk menghindari kerepotan dan kesusa 
-1,kemaksiatan merajalela terutama di sekitar pantai talise itu lgbt dianggap hal yg wajar ritual kemusyrikan 
-1,dalam instagram facebok twitter cantik depan depan takde la cantik mana bagitahu akuekarangiapa je yang nak upl 
-1,ngomongin hoax loe ted tp foto ilustrasi loe juga editan dan cenderung ngehoax hati hati penipuan pu 
-1,aku semalam hundred percent takde moodampai kan shuben peluk aku then sayang kenapa ni marah marah abang kan a 
-1,dibaikin tp makin lama makin jd apalagi keluarga sendiri huhu gmn dong jahat aja apa gue terus ya tp kl jahat mulu 
-1,yaallah disuruh ke sana lagi kari mencolot tak parani kamu alias kampret huhu
-1,kaco juga
-1,dari awal kan sudah jelas kalau hanya sekelas tukang mebel tidak akan mampu mengurus negaraebesar indonesia kita but 
-1,ga ngei lagiama mereka 
-1,mereka kan anti mainstream mainstream club kaya ini disaat idol lain manis2 mereka aiguu gue geleng2 kepala aj 
-1,aku luwih telat nemen dripada dan 
-1,space memori lelaki banyak kosong sebab tak perlu nak ingat benda bodo pakai apa 6 tahun lepas salah apa 3 tahun lepas mak 
-1,twitter skrg byk remind aku yg aku single je
-1,udah gausah baper dia itu ngetik cuma pake jari jadi kamu bacanya pake mata aja gausah pake hati 
-1,bukan coba kamu lawan sakitnya bukan coba kamu tentang sakitnya bukan coba kamu lupain sakitnya tapi coba terbiasa dengan 
-1,menitik air mata aku terbayang betapa terseksa kucing betina bunting tu mati melecur dalam mesin dryer kedai dobi taman 
-1,kalo kamu lagi dimana mana dan itu bukan daerahmu ya coba buat ngehargain apa yang ada disana jangan sembar 
-1,terasa bodo sangat harini boleh lupa park kereta kat mrt pastu selamba je naik grab dah sampai tengah jalan aku jerit 
-1,jangan sepelekan narasi2 hoax dan pembodohan oleh kaum radikal mereka sdh menguasai dunia pendidikan kita 
-1,gue mah biarin aja berarti dia lebih milih bongkol jagung dibanding berlian yang artinya dia menyia 
-1,banyak orang yang kesulitan meraih kesuksesan hal ini terjadi bukan karena mereka tidak memiliki pengetahuan namun gagal memaham 
-1,aku juga suka mengkhayal tentangmu jika saja kita bertemu dan membicarakan banyak hal dan kau bertanya kamu tidak sedih 
-1,misalnya ada suatu kondisi dmn aku bnran lg galauin km trus km ngetweet galau seolah2 itu buat aku padahal buat org lain itu babi namanya 
-1,dan aku hanyalah penyelam dungu yang mengira ngira lautmu tak berombak harus kusebut apa rasa ini kosong dan rendah gair 
-1,halah boong kamu
-1,gimana kalo kamu diposisi ceweknya nder kamu bakalan marah nda 
-1,banci itu beraninya keroyokan emak2 lagi yg dikeroyok astaghfirullahemoga aparat hukum kita punya nyali utk menang 
-1,agak kesel karena makam disekitar sarean bapak udah penuuuh banget bener2 penuh dan ga teratur ditumpuk2 gitu de 
-1,sebenarnya takyah la ciri yang bagus pun biar la dia gelap ke kerja cukup makan ke bila dah sayang dia la paling 
-1,iya akunya bukan insucure masalah komunikasi kalo bisa dm kenapa pakai wa nanti aku kasih nomer wa aku kalo wa udah bikin wa untuk alter
-1,aku nggak pernah baik baik saja kalau lagi kangen sama kamu 
-1,ya hari ini ada suporter oren yang benar benar mati oleh suporter biru kreativitas semacam apa ini memberi propaga 
-1,aku join sekali tambah syiling biar mampos jahanam dua ekor tu
-1,jangankan kalian orgtua gue sendiri pun udh nanyak woy kamu kalo udh ada yg cocok dan seriusan lgsg nikah aja 
-1,ada apa 
-1,betul lah orang kata bila kita terlalu rapat satu hari kita akan renggang yang sangat renggang and now i believe thos 
-1,gak semua org berpikiran sama dg kamu sayangku tapi kalo kamu mikir gitu ya alhamdulilah karna sejat 
-1,yaallah pengen nonton searching tapi aku benci jumpscare
-1,aku gabisa ngebacot 
-1,aku beria sekalipun bukannya kau nak appreciate 
-1,katanya gabut bosan dasar kamu
-1,kamu jahat
-1,aku pernah kacau senior aku solat lepastu aku keluar je surau kedegang tetibe aku rebah sujud ke bumi kepala bana dia terajan 
-1,aku merasa seperti aku tidak bisa melakukan apapun tanpa elfungmin 
-1,tolong sebelum kau nak kacau orang yg aku sayang kau fikir dulu mcm mana perasaan kau bila ada orang kacau buah hati kau
-1,Tiba2 kangen mantan apa kabar mantan Kamu masih hidup Loh kok masih Dulukan waktu aku pergi kamu bilang gak bisa hidup tanpa saya 
-1,kita tidak bisa mencegah atau menghapus perasaan kita hanya bs mengendalikannya atau dikendalikan olehnya 
-1,im not uke but okay kalo alesannya taken tapi whats wrong with mpreg though probably beberapa seme j 
-1,jatuh air mata bila tgk gambar bff kita dulu happy2 dgn kawan baru terima kasih sbb dulu pernah jadi sahabat terbaik aku 
-1,tadi masa basuh tgn kat sinki toilet the curve aku dgr perbualan dua org budak weh masuk la sekali kalau duduk luar sorang2 
-1,kalo nyaman lanjut lah jangan ninggalin begitu aja aku butuh kejelasan lah
-1,dia ustad kamu berani hina dia 
-1,sahabatku sekalian telah terjadi musibah di palu dan donggala gempa dan tsunami yang membawa korban ratusan jiwa wafat begitu 
-1,semua masa lalu biarlah berlalu tapi rasa syg aku ke kamu gak bakal bisa berlalu gitu aja aku syg kamu ' 
-1,kalo ada gerombolan kardus maki2 amp ngamuk2 ga usah diladeni percuma kita ngomong apapun kalo sdh benci kebaikan 
-1,kamu aja ga cape ngeboong aku juga ga cape diboongin
-1,benda yang aku rasa tak perlu nak bawak gurau 1 rupa paras 2 bentuk badan 3 insecurities kita contohnya kita gagap pas 
-1,apa lagi sial aku buat 
-1,maaf ya hyung gajadi bareng aku sama temenku 
-1,rugi la aku vote cantu hmm
-1,aku pernah baca ini barangsiapa yang menasehati saudaranya berduaan saja maka itulah nasehat dan barangsiapa yang menase 
-1,Wahai yg katanya titisan Allah Negara ini sdg tdk baik2 saja buatlahtatement berkualitas satukan Bangsa ini laya 
-1,dudu jangan iri ya kamu
-1,orangnya ganteng wangi murah senyum asik lemah lembut tapi ngetik aku masih aq bhay mz 
-1,kursi kantro aku kayak gini dan macet entah kenapa ga bisa muter padahal biasanya aku muter2 diriku sendiri kayak g 
-1,aku weird gila dengan kaun upin ipin ni bukan ke rumah tok dalang dengan rumah opah diaebelah je apa pasal bila perigi jauh je berjalan
-1,ku kira aku introvert ternyata karna nga punya uang aja jadi males ke mana mana 
-1,nyebelin banget sengaja banget buat sebell huft 
-1,sorry meera aku tinggalkan kau
-1,hati2 dgn rezim otoriter orde baru yg berupaya bangkit dari kuburnya dgn menebar isu pki dsb jangan buang waktu deba 
-1,hai kami memahami kendala kamu dan mohon maaf atas ketidaknyamanannyaaat ini pulsa kamu sedang da 
-1,kalo idup lo kebanyakan pencitraan sm drama kita mana tau ya yg mana yg bener yg mana yg halu 
-1,ayah bising sebab dia tengok aku beli tudung banyak banyak last last pakai tudung indon jugak sebab aku bagi reaso 
-1,tlg please bg perempuan tu baca malu wei lagi malu bila dia beria cerita kat kwan dia n aku skli dengar aku n 
-1,fpi jahaaaaatttetiap ada musibah mereka paling awal datang jadi gak enak nih sama ormas ormas yang selalu merayakan nkri ha 
-1,kita sering ga sepaham 
-1,nampak nye seperti semua mahu meletakkan kesalahan itu di atas bahu saya sahaja dan bos saya pernahkah anda fikir 
-1,rakyat indonesia berduka atas musibah gempa amp tsunamiulteng palu amp donggala juga negara2 di dunia ikut berduka aku mo 
-1,tampaknya selama jd ketua pssi ga becus jd pembina psms medan jg tdk terlihat prestasinya entah soal jab 
-1,aku diam bukan tak amik kisah langsung kadang kadang tu stalk jugak 
-1,pengen marah tapi gak boleh gini gini disini aku penanggungjawab soal dokumen nah kalau ada apa apa ya mbok ce 
-1,aku sedih lah first time ni ada customer request camni 
-1,yang kacau tu otak lu saudara sebangsa sedang kena musibah masih juga di politisir orang yg teriak nkri harga mati tida 
-1,banyak anak muda belum berbeda dari bayi mereka marah kalau mainan mantan yang dibuangnya diambil anak lain
-1,ohhhhempat la kalau nak jmpa aku lgi aku ckup bulan 9 ni aku balik melaka huhuhu
-1,masuk tandas pun bayar okay mana ada free nak main bagi bagi 
-1,oh iya ini juga kalau rayen tinggal diurabaya udah pasti nggak bakal satu sekolah sama eze tipikal anak bas 
-1,yezza if sayangkan persahabatan 8 9 tahun lupakan pergaduhan 5 minit yg lalu its really hard untuk salah sorang 
-1,kenapa doa kita masih belum dimakbulkan fahamkan allah dahulukan apa yang kita semua perlu bukan ikut apa yang kita mah 
-1,ternyata disini kamu mengakui kalau kamu goblok yaa fantastik kejujuran yg patut di apresiasi 
-1,kita dulu dilatih utk congak kids nowadays suruh congak punya lah lambat i don't know how maths are taught these days bu 
-1,itu siapa yg bikin videonya bani cingkrang goblok bin pekok tolol kebina bina dr sblm zaman jokowi juga pintu 
-1,kamu jahat dubu lt 
-1,seegois itukah kamu jangan siksa aku seperti ini aku lama lama juga capek kalau kamu sudah tidak ingin lagi deng 
-1,gue mau belajar terus tau tau liat exo mengeluarkan sesuatu aku shock berasa mau nange 
-1,aku tak kuat lah nak hadapi semuanya dan aku tak mintak pun jadi macam ni kenapa kat aku semua benda ni jadi kenapa 
-1,kita adalah tempat singgah sementara bagi mereka yang datang tapi bukan untuk menetap 
-1,aku takut kau terajang orang tu je nanti
-1,baru aja buka grup kelas dan isinya menyinggung tentang aksi mahasiswa di pekanbaru kemarin bingung harus gimana aku tu 
-1,subhanallah inilah penyebabesungguhnyaemoga kita semua menyadarinya prayforpaludonggala 
-1,enggak usah bersikap seolah olah kamu penuh dengan teka teki kamu diem aja kadang aku gak ngerti 
-1,aku ni malas nak layan orang kang tak layan kang kesian dh layan kang fake hope haiyo apa nak buat ni 
-1,meluas hingga menjarah apa saja emas dll apakah ini demi hidup atau memang murni kriminal boleh jadi para maling yg hi 
-1,16 memang perilaku pendukung spt itu apa pun dipolitisasi demi kekuasaan pribadi termasuk bencana alam kalau 
-1,terkadang suka ngerasa sedih liat temen2 kita udh pada bisa ngehasilin duit sedangkan kita sendiripun msh berjuang 
-1,orang sabah jangan kamu kasitau pulau mana yang selamat biar dorang kenak culik betul betul oleh abu sayap 
-1,aku ke kampus untuk menuntut ilmu ketemu wong2 podo gak takon yoweslah 
-1,bisa jadi ada orang ketiga yg hendak memperkeruh dan kemudian kita saling menuding satu sama lain soal ratnaarumpa 
-1,jika ada orang yang membenci kita tanpa sebab yang jelas apa lagi kita sudah meminta maaf jangan balas membencinya kar 
-1,aku ga pernah ngitung kekayaan mereka jadi ak ga tau yang pasti mereka lebih kaya dari pada aku soalnya aku missqueen
-1,yang melakukan pengeroyokan ini banci padahal ibu nya wanita dimana hati nuraninya coba negeri ini apakah sudah 
-1,pengkhianatan seorang menteri dan ketua umum partai pengusung juga harus cepat diselesaikan oleh mereka dalam waktu 
-1,semua sibuk aku doang yang engga gabut solo 
-1,tapi kan prabowo sandi bukan pejabat 
-1,sangat dan aku kesal sekali
-1,warga donggala membantah ada penjarahan kepada antara yang menjadi media pertama yang menemui mereka mereka mengharapkan 
-1,kalo kamu lagi dimana mana dan itu bukan daerahmu ya coba buat ngehargain apa yang ada disana jangan sembar 
-1,kalau tak bersungguh nak jaga aku boleh je berhenti berpura2 aku boleh jaga diri aku tanpa memaksa kau kau tak perl 
-1,kelak bukan aku yang akan kamu rindukan tapi hatiku rumah ternyaman yang pernah dihuni oleh cintamu 
-1,mbok kalau mau ngutip pilm itu yg sedikit nasionalis kek misalnya kamu tuh kalau lagi kebingungan lebih nyenengin ya 
-1,jangan malakin aku brlum main drama udah di palakkin aja hasemeleh 3
-1,kadang kebaikan kita sering disalahartikan 
-1,maybe now u won but its okay kita takkan sentiasa di ats just do wht ever u want u guys yg mintak aku benci korg 
-1,pria sering kehilangan wanita yg dicintainya karena mereka tak pernah mau belajar menghargai perasaan wanitanya 
-1,gimana rasanya belum mulai udah dikatain masih belajar udh mau dipatahin kakinya army mah masih baik kita gamau kasi 
-1,entah azab kubur macam mana lah korang bakal kena nanti 
