sentimen,Tweet
1,pendekatan pembangunan daerah tertinggal berbasis seni dan budaya diharapkan dapat berkontribusi dalam pelestarian kearifan 
1,bantuan sudah berdatangan untuk saudara kita di palu dan donggola gerakcepatuntukpalu 
1,ini yg aku suka pura2 waras partai berkarya kemana ya hehehe
1,ppangon hahahaha gapala lhaaa gemasss tangan lele harus dimuseumkan karna aku juga suka 
1,sejak bila bini wajib kena masak ni kita as men yang patut bersyukur sebab perempuan sekarang rajin nak bekerja a 
1,aku juga lagi nyari
1,ajak aku
1,harapan aku cuman satu semoga orang tua aku masih ada disaat aku sukses nanti 
1,ya allah ya tuhanku kau lindungilah kedua ibu bapaku disaat aku berjauhan dengan mereka 
1,biy betol laa dengo bossned panggil nora danish sayangayang dia ada sa'duu alahaiiii meltingnya aku dengo 
1,aku tak suka lukis art org lain tp i tried amp i loved the process alhamdulillah owner pn suka sgt 
1,terima kasih surprisenya dan temen2 semuaa seriusan surprised banget sarcasmukses untuk ki 
1,alhamdulillah masih hidup lagi aku huhuhu
1,shrsnya hari batik nasional ditunjang dgn bntuk kepedulian dan dona 
1,kuserahkan semuanya pada waktu agar kita bisa bersatu dan untuk saling mencintai 
1,lelaki yg suka bagi nasihat agama kat perempuan usually low key gatal tu cuma teknik nak ngorat fight me 
1,aku sumpah cheese ni penyelesaian segala masalah kat malaysia nak kedai makan laris jual makanan dengan cheese nak b 
1,karna exo ngeluarin teaser dan aku belum pernah menang ga jadi aku bakal ngadain ga kecil an aja aku pilih 5 pemenang ya 
1,terkadang untuk membuatmu menyadari siapa dirimu tuhan tak memberi orang yang kamu inginkan tapi orang yang kamu butuhkan 
1,aku mencintaimu karena allah dan aku takkan pernah mau dipisahkan denganmu kecuali allah yang memisahkan kita 
1,pacar yg baik itu yg bisa ngehibur kita disaat sedih ngabarin kita tanpa harus kita nunggu dan kalo ngerasa bosen dia gak akan mutusin 
1,hai happy birthday to you semoga apa yang kamu citacitakan tercapai panjang umur sehat terus s 
1,benar kan aku 
1,iyaa semoga ga tambah panjang urusannya aku kaget bgt pas liatnya
1,aku selalu berusaha ngasih yang terbaik untuk kamu aku takut semua perhatian dan sayang aku gak pernah cukup untuk kam 
1,2 describe asramakuuperekaliiii mereka ramah banget humble welcome ke newizzy nya semua jadi satuu tapi 
1,pilih salah satu yang paling kamu nyaman
1,gak apa apa deh aku gak punya pacar asal bisa diginiin terus 
1,dengan berbagi itu maka hubungan diantara mereka akan kuat karena dengan berbagi itulah sikap peduli dengan sesama manusia my quotes 
1,aku dah moveon tau kenapa senyum dekat aku tdi aku dah cair balik 
1,biarpun aku gak keren tapi aku bisa selalumembuat kamu tertawa nobita
1,aku mau ini udah dri kpan tau tpi blum bisa kbli2 karna uangnya dipakai buat yg lain dlu ' wish me luck 
1,jangan pernah sakiti sahabatmu karena sahabat adalah cara tuhan untuk menunjukkan bahwa dia tak ingin kamu sendirian
1,done watching dilan 1990 2018 dari start movie sampai habis aku senyum sorang nasib baik tengok sengsorang kalau ram 
1,aku up banget lah wkwk
1,viralkan jokowi kukuh jaga kedaulatan dubes tiongkok dekati prabowo keputusan jokowi itu juga membuat lawan politik 
1,terkadang orang yg paling kamu inginkan adalah orang yg membuat hidupmu tak begitu banyak sedih jika tanpanya 
1,laa patutlah bapa aku pakai dp wasap accapan farewell 
1,bila nak macamni hahaha 
1,hahaha bukan salah aku eh aku tak de kelas pun harini
1,dalam hidup ni kena belajar dua benda iaitu sabar dan redhaabar dengan semua benda yang terjadi dan redha apa yang da 
1,aku tak power mana pun masak memasak nie tapi aku harap bila dah kawin nanti setiap hari aku dapat masakkan suami aku d 
1,semangat buat hari ini guanlin sayang cepet pulang aku kangen gt lt 
1,sbab allah masih sayangkan kitabab tu musibah diturunkan supaya kita sedar dan dekat kan diri dgn allah 
1,keluar dari kepompong dan menjadi kupu kupu yang cantik aku ghaida 
1,kenalllllll dekcik ada dgn aku masa aku sedih amp happy 
1,Kamu lucu udah kaya jin ifrit deh 
1,trimakasih sobat twater trimakasih berkatmu aku jdi boros hari ini hehe 
1,Selamat Hari Batik Nasional Kamu Makin Cantik Kalau Pakai Batik Bolehkah Aku Tertarik 
1,loalah iya beh coba ikut cpns beh smoga kita segera dapat kerja yg cocok aamiin 
1,senang senang je aku diperbodohkan duluob sob 
1,Wakakak right apakah skrng kita harus say goodbye dngn kokobop ' 
1,aku seneng kamu menaruh ketertarikan gini hehe kalo yang anti2 baca aja gamau kan
1,cakep dan mantap ulasanya hati2adayangkelonjotan 
1,ya allah aku berlindung kepada mu dari siksa kubur dari siksa neraka jahannam dari fitnah hidup dan mati dan dari f 
1,wkwkwk ko sinyo gampang melar aku juga apakah kita ini 
1,terima kasih para nasabah untuk 20 tahun kebersamaan kita 20 tahun bank mandiri terus berkarya membangun negeriaatnya 
1,aku akan bertahan selagi aku bisa namun disaat aku sudah tak bisa dan tak kuat bertahan maka aku akan pergi dan menjauh 
1,pdhal aku bisa jdi so sweet juga ko ga percaya mau bukti ayo buktiin kalo gagal barang bisa kembali 
1,giveaway lagi nihhhh aku akan jadi karma buat kebaikan yang udh kalian lakuin selama ini dgn cara bagiin parfum yg lg hits 
1,aku dengan kakak aku always wey tak pun yo 
1,aku akan happy af kalau capa pergi please capa 
1,hahahahahahahahah babi 
1,siapapun yg mau beli hp ini met bobo moga mimpi indah bangun2 segeremangat hari2nya dari aku yg masih mend 
1,aku rasa macam nak bercerita la malam ni hahahaha tajuk yang aku nak cerita ni pasal kekasih yang tak wujud ya ini 
1,kerja keras dan prestasi yang membanggakan terima kasihemua pemain coach fachritaf pelatih official bangkitsepa 
1,ok nder 3 bulan waktu yg cukup buat jd lebih cantik aku jg malah ketemu doi 1 stgh taun lagi hehe udah 
1,di peringatan hari kesaktian pancasila ini saatnya kita mengamalkan nilai nilai persatuan yang terkandung di dalamnyaaatn 
1,dalam keadaan jelek pun kita tetep setia temenan sama lo lay happy birthday 
1,aku yang baik 
1,this is especially the truth aku pun nasib baik tak rosak liver konon nak cepat kurus cut sugar intake calorie counting 
1,agcemangattreaming dan vote ya guys kemungkinan minggu ini kita dapet trofi lagi masih besar asal jangan kasih kendo 
1,tanggal 2 oktober batik diakui oleh unesco sebagai warisan budaya dunia yang berasal dari indonesia yuk jaga war 
1,jatuh cinta itu dek tentang pantas atau tidak pantas tentang siap atau tidak siap tentang berjuang atau tidak berjuang ja 
1,Segera sembuh bu yakin anda seorang wanita yang tangguh itu mengapa mereka panik Allah always with you 
1,teruntuk idola semasa remajaku aku doakan dirimu bisa menjadi istri yg sholehah dan berbakti kepada suamimu kan k 
1,lucu sekali sih kamu jadi pen gigit 
1,meskipun kata dokter gak boleh tapi aku masih percaya kalo bawang merah bisa ngurangin perut kembung d
1,cik din panggil mai kerja cashier mydin balik hahaha bagi gaji basic 2k baru aku pi 
1,warga kampung lere palu bersyukur ada relawan fpi yang sigap dan radikal mengevakuasi jenazah kerabat mereka yang menjadi korb 
1,dari 9 nilai gusdur ada diantaranya kemanusiaan dan persaudaraan mari kita kokohkan nilai persaudaraan kita untuk saudar 
1,cinta tak harus mencari kekurangan dari pasangan tapi yang penting bagaimana kamu salaing melengkapi dalam kekurangan
1,jangan lupa sholat jumat ya sayang aku jelek ya sayang ' bukan biar ganteng ih itu kan wajib oh kirain makasi 
1,jurina san kapan datang ke jakarta yaa apa dia tunggu aku yang ke jepang wkkwkwkw candadoeloe aamiinin ajaa 
1,tertib sekali buah budaya disiplin di indonesia truk bantuan mini market swalayan dijarah kalau bahan makanan 
1,macam aku cakap jangan jadi terlalu baik nak buat baik berpada pada lah 
1,btw kamu cantik nder 
1,aku sumpah cheese ni penyelesaian segala masalah kat malaysia nak kedai makan laris jual makanan dengan cheese nak b 
1,bersyukurlah hingga kamu lupa rasanya kekurangan tulisanirin jumatberkah 
1,luaaar biasah tokoh kharismatik nu dan ribuanantri dukung prabowo pengasuh pondok pesantren attauhidiyah gi 
1,ini adalah contoh yang baik mungkin satu hari kita boleh ikut cara ini 
1,kalo aku pake bahasa asakusu sasayasang basangtasan wkwkwkwkwkw
1,wah pas banget aku abis bikin tiktok baru
1,terkadang lebih baik mengalah bukan karena kamu salah tapi karena dengan mengalah kamu tak kehilangan dia yg kamu cinta am
1,kek aku nggemesin yaaa asli produk lokal wee
1,aku hanya ingin mencintai orang yang memiliki rasa cinta hanya padaku untuk selamanya
1,dear kamu terima kasih
1,hihi 
1,jadi begini sayang kamu hanya perlu memilih mana yang menginginkanmu hanya di saat waktu luangnya atau yang menginginkanm 
1,sepakat pak dan kami siap mewujudkan pilpres yg berintegritas hanya 2 hal permi 
1,selamat hari batik nasional mari kita jaga warisan budaya indonesia batik indonesia nasionalisme eztudia 
1,percaya yang sesungguhnya adalah ketika kamu tetap percaya sekalipun sulit dipercaya ri
1,lah aku ke miniso isinya cewe2 semua mba karna dia lucu jadi aku bawa pulang wkwk
1,aku merasakan sebuah pencerahan hari ini 
1,gitagut buat apa cari yang perfect kalo kamu aja udah bisa buat aku bahagia 
1,buat dong aku kan juga istrinya daniel 
1,cantik nya kaya jisu unnie dong aku g
1,laksanakan segala apa yang diwajibkan allah niscaya kamu menjadi orang yang paling bertakwa hr ath thabrani 
1,repost by sandiunoaatnya kita menolong satu sama lain kita bangkitkan kembali semangat bergotong royong saya men 
1,bangganya emak2 disebut cawapres bang diacara pentingilaturahim fraksi dan launching lag 
1,okay yg ni aku nak gelak hahahahahaahhaa
1,wiih keren makasih yaasobat magangersmk 1emarang semoga ilmu yg kita berikan bisa bermanfaat semangat suks 
1,mau bubeks mau 
1,terimakasih sukses selalu 
1,first giveaway ga dalam rangka apa apa pengen aja heheyaratnya rt reply warna mau cream terang grey ongk 
1,senangnya orang buang aku dah dapat apa yng dia nak then menghilang 
1,tuhan sehatkanlah orang tuaku bantulah aku untuk belajar dan bekerja bagi kebahagiaan mereka aamiin
1,moga2 allah berikan aku bersalin normal dengan selamat kali kedua nanti 
1,aku penginne kerjo ng tmpat dgn bismis
1,cinta itu bukan sekedar logika saling bersama tapi cinta lebih kepada menjiwai bersatunya kamu dan aku dalam indahnya semesta 
1,pegi kedai bawak lah adik aku teman pastu uncle tu tanya ni anak you ke muka sama hahaha muka aku macam orang dah kawin ke doh
1,ingin aku memiliki
1,apapun yang berlaku akan aku tetap teguh berdiri di sini
1,ya allah aku berlindung kepada mu dari siksa kubur dari siksa neraka jahannam dari fitnah hidup dan mati dan dari f 
1,mantaaab majulah indonesia majulah umkm kita
1,aku bersyukur sebab bertanya much thanks to my dear friends 
1,jatuh dan gagal sudah biasa tetapi jatuh pada satu hati itu baru luar biasa dan itu hanya terjadi pada kamu 2019pilihjokowikyaimaruf
1,aku rasa aku power hahahahaha
1,hahahahaha at least kita tau mana daun kari 
1,aku kalau pegi ecm kan mmg aku hanya guna toilet gsc jebb bersih gilaaa siap steady boleh berakk lagi hahahahaha
1,nasib baik akak aku normal 
1,karna sekarang aku lagi ulang tahun dan besok hari enip nya ikon aku bakal adain ga pulsa 10k untuk 2 orang cukup aj 
1,boleh bgttt hehe nanti aku kabarin lagi yaa 
1,berhenti merokok selama 20 menit memperlancar tekanan darah denyut jantung dan aliran darah tepi lho apakah kamu sudah si 
1,jangan tanyakan mengapa seseorang membencimu sebelum kamu tanyakan dirimu sendiri mengapa kamu peduli akan hal itu twittbot
1,pagiii semangat aktivitasnya aku lagi otw ke ke kampuss sambil sarapan uwaa harini kelas dari pagi banget sampe sore 
1,nah ini aku setuju mba biar kapasitas otak calon pemimpin bisa teruji 
1,kita memerlukan kekhawatiran untuk mendorong kita bersungguh sungguh bekerja mengatasi kekhawatiran dan kita membu 
1,hehehhe tak faham kan diorg ni actually pandang apa nak apa kita golongan kene tindas 
1,ternyata nyari kebahagiaan gaperlu ribet ya cukup dengan usaha kita yang ternyata udah buat seneng orang lain aja 
1,karena aku percaya allah sdh mentakd 
1,pergilah ke panti asuhan agar tau nikmatnya msh punya org tua yg menyayangi mari sayangi org tua kita 
1,10tahun terima kasih kerana banyak mengajar aku banyak benda dan erti dalam hidup terima kasih untuk dunia yang indah terima 
1,tuhan bijakkanlah aku dalam mengkhawatirkan masa depanku agar aku tak melumpuhkan masa kini ku
1,temen doakan aku ya biar bisa dilancarkan buat ngerjain skripsi terutama bulan ini 
1,iyooo hahaha dadakan tiket pesawat mahal dong o o banya yg dpt hrsny kuikutan aja hahahhaha yg menang dpt cat 1 smu 
1,bagi aku ler kalau tknak hahaha
1,sama 
1,wargi dahlia saatnya kita bergoyang asyiikk diacara yangdigoyangyang bersama kalpanax ahlinyaatasijamurkulit amp 
1,wkwkw aku yo ngono mau wis otomatis iku koyoke
1,rlt inilah alasan kenapa aku cinta twitter ' cr sharpanocopath 
1,dirikanlah shalat dan suruhlah manusia mengerjakan yang baik dan cegahlah mereka dari perbuatan yang mungkar da 
1,nanti aku liat deh wkwkwk
1,iya huhu aku sayang mutual disini 
1,be strong bro 
1,di antara buku buku kesukaan yang kaubaca sampai malam kian jauh dan sendiri aku ingin jadi buku yang menelungkup di d 
1,ni kalau suami aku panggil sayang macam ni we're gonna make babies right after 
1,saat ini di kecamatanonggon misalnya sudah tanam bawang putih 25 hektare pada ketinggial 650 mdpl dengan dibant 
1,andai kita berani mencoba dan kita lebih tekun dan ulet maka pasti kegagalan tak pernah ada 
1,aku juga mau dihujani uang buat beli tatcha mahal bgt
1,hebat cara orang kita berfikir epic 
1,we love you yunia kamu harus semangat jalanin ini semua kamu ga sendirian kok disini kita satu kelas bakal selal 
1,nah iyaaaa itu jg gua bingung apa kita kurang cherish the moment aja gitu ya jd apa2 kolup wkwkwk
1,hahahahah berdekah aku tengok parody ni sumpah kreatif dakdak ni munafik2 
1,bagiku hidup ini bukan tentang bagaimana aku harus menjadi orang baik tetapi lebih kepada bagaimana aku bisa bermanf 
1,semoga hari ini tuhan menggantikan kecenderungan kita untuk mengeluh dengan kesegeraan untuk bertindak
1,yg ingin putar balik sejarah harus kita lawan 
1,bestfriend aku jelah yang boleh faham aku sepenuhnya yang tahu time bila aku moody aku sedih aku happy amp everything di 
1,lakukan perkara yang membahagiakan jiwa kita favoriteocial artist amas 
1,tadinya mau translate ke english alhamdulillah udah ada yang duluan kata2 bagus harus dibuat universal biar yang 
1,babi dora the grownup pun banyak tanya lagi ke dahlah aku real life pun duduk office hahahhahaahhahaah
1,bukan hasil yang kita inginkan namun apresiasi tinggi untuk perjuangan skuat timnas u 16 yang telah memberikan segalanya di lapa 
1,pray for palu donggala lombok buat saudara2 kita di sana semoga diberikan kekuatan ketabahan keikhlasan hadapi ujian dr allah amin
1,kerana kita manusia walau semua orang membenci pasti ada yang masih sanggup menyayangi jika tiada walau seorang dia sentiasa ada 
1,aamiinn tapi ustaz punya sorry memang win 
1,mau bantu aku nabung 
1,aku mulai mendewasakan cinta membiarkan kata katamu amarahmu egoismu keras kepalamu lepas dari tubuhmuedangkan aku 
1,harta yang ada rezeki yang dikurniakan biarlah kita guna ke jalan allah moga selalu diredhai insyallah amin 
1,hahaha mereka lebih suka menghentam dari memberi isi yang betul
1,tuhan aku ingin kaya aamiin retweet atau bilang aamiin jika anda juga ingin kaya 
1,wkwk harusnya aku tanya juga pertanyaan itu karena aku kepo and i knew her since long 
1,yaudah cari dulu kalo udah cari tau kasi tau aku hahahahahha
1,bila aku sedih aku selalu ingat ayat ni takpa lahh allah sayang kau sebab tu dia uji kau dengan macam macam dug 
1,selamat danukses mujahadah kubro dalam rangka memperingati haulholawat wahidiyah dan haul mbah kh mohamad ma'ro 
1,jika allayarham tun abdul razak masih hidup beliau bersyukur anaknya meneruskan agenda membantu org luar band 
1,ngantuk aku tidur dulu jangan khawatir besok aku masih mencintaimu seperti biasanya besok aku masih ngirim pesan seperti 
1,t kasih semua kalau nak bantu aku kumpul duit lagi banyak korang beli lah ini klik sini untuk beli 
1,aku cinta segala promo grabfood karena bisa makan burger mcd seharga ayam geprek 
1,aku ada minat 
1,kalian yang bisa memberi seseorang cinta dan kesungguhan bisa meraih apapun aku percaya itu karena itu adl sesuatu y 
1,jangan pernah meremehkan diri sendiri jika kamu tidak bahagia dengan hidupmu perbaiki apa yang salah dan teruslah melangkah ds
1,biar aja aku memang suka ngeramein kamu beb 
1,bgsd aku ngakak 
1,mamahbijakesungguhnya tidak ada batas dalamabar karena jika ada batasnya berarti bukan kesabaraneperti 
1,kalo aku yg menang jajanin ya wkwk 
1,berarti aku sepecial 
1,hehe tau aja kamu
1,weh sumpah do tolong la sesiapa jumpa kad matrik aku taknak buat baru 
1,teens fannie kamu tau nggak ada yang lebih indah amp lebih bersinar ketimbang bintang hah emang ada ada kamu
1,ayoo kita otw bareng biar aku ada temen nya wkwk
1,haha apa sih mak iya kan nanti habis itu juga kamu nyusul halal kain apa mak kain lap haha
1,semuanya harus santun dan acungkan jempol ketika masyarakat sudah memberikan akses sbg tanda terima kasih pak 
1,aku kat sini mencarut carut sieyy hahahahahahahhhahaha
1,aku suka liat kamu ketawa seperti ini jaga senyum dan tawa mu my bear karna kamu sumber kebahagiaan ku saran 
1,pada tanggal 2 oktober 2009 lembaga kebudayaan internasional unesco meresmikan kain batik sebagai warisan kemanusiaan u 
1,sahabat yg budiman mari kita hadiri kajian muharram umum dahnil anzarimanjuntake me tema hijrah tempat 
1,dear kaum hawa ciri bf apa yang anda suka aku tanya hawa yang jantan jangan komen hahaha
1,kereeeeennnn
1,alhamdulillah hidup lgi yg penting hahaha buat masa ni tkdelah tkde rindu lgi kt shah alam tu he 
1,terima kasih ya allah terima kasih kamu terima kasih alam terima kasih semuanya yang sudah menyadarkan kembali b 
1,tuhan tolong aku ku tak dapat menahan rasa di dadaku
1,katanya sayang sama orangtua tp status wa disembunyikan dr orangtua hehe itu aku
1,sesulit mana pun keadaan kamu jangan pernah mengalah kerana aku insan yg dipilihnya
1,aku baru menyadarinya setelah sekian lamaemoga kelak dapet dospem yg baik hati 
1,gaiss perpantunan kita punya potensi viral berarti wkwk 
1,sayang lebih aktif lagi yuk yuk yuk biar aku ga kangen 
1,segitu kangennya ya mba sama aku 
1,setiap orang memang berhak menilai dirimu tanpa tau siapa dirimu tapi ingat kamu juga berhak tuk tak peduli denga 
1,haah sama je tengok bapak la batch kita ramai pregnant julia pun sikit hari hahahahah
1,hahahahaha terhibur betul lah lol semua tempat dia tiful kan ingat ke aku sorang je perasan typo dekat caption tu 
1,kalo di surabaya liat cece cece ngomong kayak anak jaksel tapi logat e suroboyo gyettt be like lah ya ntik gua pick up 
1,bantulah saudara2 kami tuhan selamatkan mereka semua jauhkan saudara2 kami dr segala cobaan dan marabahay 2019tetapjokowi
1,ye saya cacat ye saya ada juga menangis kadang kala tapi alhamdulilah allah jaga hati saya daripada dengki dengan orang htt 
1,aku cinta bahasa indonesia
1,apa yang kamu anggap aneh aku anggap luar biasa 
1,okey aku maiii
1,lucu do tadi kak cafe asal mana dik mearawak kak k cafe org mana me kuching kak k cafe ohhh org bandar 
1,cantik dan manis toketku 
1,suka dengan ayat ni rezeki itu datang dari 3 cara datang sebab kamu cari datang sebab allah nak bagi dan datang seb 
1,wkwkwkwkwkwwk tumben sekali kamu bepikir positip iiiaaaa
1,adik aku ni umur aku ni dah 24 setiap kali aku whatsapp senyum ke dalam group aku macam happy sikit mesti dia b 
1,aku jenis yang easy to forgive hard to forget bukan berdendam tapi nak jadikan sebagai pengajaran dan pengalaman dalam hid 
1,sama aku ajaini
1,emng gemesin mereka 
1,booth bongkar pasang rangka alumunium praktis danimpel bongkar pasang 1 menit rangka alumunium body multiplek 
1,sebagai orang beragama sepantasnya kita merenung ga usah ditanggapi miring jgn buruk sangka dulu
1,sahabatan itu perlu buat tempat curhat seneng2 dan buat hidup lebih asyik tanpa sahabat mungkin hidup kita kesepian mrzprlquotes
1,hahaa aku juga ga ngerti tadi tp asal jwb aja
1,thread kontrol ke psikolog psikiater sampai akhirnya aku bisa rubah sikap buruk aku dan bangkit dari keterpurukan ke ps 
1,kebahagiaan tidak akan habis hanya karena membaginya ketahuilah kebahagiaan bertambah ketika kamu bersedia untuk berbag 
1,hidup memang tak mudah tapi jika kamu terus berjuang tanpa lelah akhir yg indah akan selalu menunggu tuk kamu sapa 
1,suami pun dah macamherlock nak kena berfikir bagai utk dapat jawapan power haha
1,luv 
1,wkwkwk waktu itu aku baperin tinggi badannya 
1,antara indahnya persahabatan ialah saat kita memberi namun tak mengharapkan balasan
1,aku ngakak bacanya 
1,akhirnya giveaway wk terima kasih 2018 karena sudah memberi banyak kabar bahagia dan semoga begitu pula u kalian 
1,ikhlas bukan berarti kita pasrah menerima tapi ikhlas adalah kekuatan besar untuk kita terus berusaha agar mendapat yg lebih baik egha ys
1,mau nya kamu itu sih hahaha
1,alhamdulillah review positif lagi untuk dindakanda terima kasih kak mahiran zakaria cakap d dengan khairi r 
1,hai orang2 beriman apabila diseru menunaikan shalat jumat maka bersegeralah kamu kepada mengingat allah dan tinggalka 
1,aku mau kerja di sana 
1,kebahagiaan hanya akan menjadi nyata saat kita berbagi jalanjalanin
1,sini aku ajarin
1,selama ini yang msh jadi favorit msh laskar pelangi 
1,murah banget btw tadi aku juga abis bikin pecel
1,Maka bersabarlah kamu seperti orang orang yang mempunyai keteguhan hati dari rasul rasul telah bersabar 46 35 
1,aamiin yaa rabb be strong bund 
1,berkutat lagi dengan skecap dan interior aku bahagia 
1,bersyukurlah kita sebagai rakyat malaysia 
1,Kamu tau kan di Mimin sering banget kasih promoengaja karena Mimin mau kamu yang rajin membaca tweet Mimin jadi 
1,sesungguhnya apabila seseorang terlilit utang maka bila berbicara ia akan dusta dan bila berjanji ia akan pungkiri hr al bukh ri 
1,bighit cerdik ya awal tahun army disuguhi run bts run bts hiatus mereka comeback comeback kelar ada worldtour lg worl 
1,bikin instastory cuma biar kamu reply terus ngobrol hehe 
1,bagi yang waras bencana adalah persoalan yang harus kita selesaikan bersama bukan malah dijadikan oplosan sampah sumpa 
1,seneng dong punya kembaran lokal nanti aku suruh main rp biar seperti momo twice dan ga perlu koleksi poto 
1,siapa sahabat kamu mereka yang hadir dalam doa aku dan menghadirkan aku dalam doa mereka 
1,tuhan merawat semua perasaan dan keputusasaan kita baik yang telah menyala yang masih bara bahkan yang telah sirna 
1,ngakak aku wkwkwkw
1,perbaikan tiang dan gardu listrik akibat gempa di palu sdh mulai dilakukan 03 doauntuksultengaluranpemer
1,biasane soale aku ngono seh
1,kamu tau gak kalo nama kamu selalu aku selipkan disetiap doa2 aku utk kesehatan pekerjaan rejeki keluarga ah 
1,karena mbk lia banyak cinta pasti kuliah advokatnya sukses love you more mbk
1,assalamualaikum berdoa dan menundukkan kepala untuk semua korban gempa dan tsunami di donggala palu mamuju dan sekit 
1,voice dan signal really recommended
1,apabila suatu hari nanti terjadi hal hal di luar ingin kita aku ingin kamu percaya bahwa untukmu aku akan selalu ada m 
1,yuk netweetjen dibantu
1,tlw bukan prank hahaha benar memiliki rasa kagum ke kamu terlihat pengecut ya hanya bisa melalui base di peruntukkan 
1,sayang lagi sakit jadi aku harus sentiasa ada buat sayangku 
1,diriku sendiri karena aku adalah idaman 
1,jaga lah solat walaupun kita bukan orang yang baik 
1,lah kan emang cantik dek masa iya ganteng kalo kamu ganteng trs gua apaan dek 
1,iya kita tunggu sejauh mana kebenaran beritanyakalau hoax ya musibah kalau bener ya anugrah wkwkwkwkwkkwwk
1,terharu baca threadnya kamu baik banget sih semoga rezeki kamu lancar terus next time semoga aku bisa menang ga 
1,aku nak kongsi satu kisah pasal perubahan dan istiqamah ada sorang kawan level adik adik ada masalah dengan gangste 
1,tidak perlu memfokuskan memikirkan orang yg membenci kita karena masih banyak org yg menyayangi kita 
1,Bersyukur dan ikhlas menerima apa yang di berikan Tuhan kepada kita Niscaya hikmahNya tidak akan berhenti mengalir Believe
1,sesungguhnya aku hanya tinggal bersabar dan mematuhi nasihat baik kebaikan yang kulakukan adalah untukku
1,mari berdoa bersama semoga allah senantiasa memberikan anugerah keselamatan dan kesehatan bagi kita semua bagi saudara kit 
1,hahahahaha terhibur betul lah lol semua tempat dia tiful kan ingat ke aku sorang je perasan typo dekat caption tu 
1,senjaku sendu kopiku beku anganku beribu inginku kamu 
1,ga ada masalah kok yg masalah itu kalo kamu sama sekali nggak mau mulai eaaak akun motivasi 
1,menyusuri keindahan sungai martapura bersama dan sahabat2 ansor kota banjarmasin mantap gaes karena 
1,punya teman 
1,jangan berpikir kamu tak mampu melupakan masa lalu tutup pintu masa lalumu karena tuhan selalu buka pintu masa depanmu 
1,kamu itu manis tapi sayangnya manisnya buatan d
1,jangan hanya berharap dan menunggu tuhan memang akan selalu memberimu yang terbaik tapi kamu tetap harus berusaha 
1,tls followan ama aku yukk rep rt kita temenan
1,hahahahha nasib aku adekan saport kau dulu tidak nanti hambar
1,im not alone gak salah kok bagus biar mereka capek ngatain 
1,yora syg sabar yeenyum sikit itu pendapat dia je xsemua ckp mcm tu kita sama sama contribute n sama sama ber 
1,dosen2 macam bu lilis ini nih yg bikin aku tambah pengen jadi orang hukum
1,virgo apapun yg terjadi merupakan proses untuk kehidupanmu yg lebih baik lagi jangan mudah menyerah hanya karena satu 
1,klien adalah raja yang satu ini seringkali manja gemesin banget deh kamu
